Sentence,time,EventType,Polarity,Labeled
" The nation's home builders continue to feel much better about their industry, but the dramatic gains seen through the summer and fall appear to be moderating.","Tue, Dec 18 2012 10:00 AM EST.",market_prediction,,"<P_START/><S_START/><DATE>Tue, Dec 18 2012 10:00 AM EST</DATE>.<S_END/> <S_START/>The nation's home builders continue to feel much <EVENT type=""market_prediction"" VerbTime=""present""><SLOT name=""Pos_fin_word""><POS_FIN_WORD>better</POS_FIN_WORD></SLOT> about their industry</EVENT>, but the dramatic <POS_FIN_WORD>gains</POS_FIN_WORD> seen through <DATE>the summer</DATE> and fall appear to be moderating.<S_END/><P_END/>"
"Consumer sentiment slipped in December but was not far from the year's highs, suggesting Americans were guardedly optimistic about the economy in the holiday season.","Fri, Dec 22 2006 10:42 AM EST. ",market_prediction,,"<P_START/><S_START/><DATE>Fri, Dec 22 2006</DATE> <TIME>10:42 AM EST</TIME>.<S_END/> <S_START/>Consumer sentiment slipped in <DATE>December</DATE> but was not far from the <DATE>year</DATE>'s highs, suggesting <NORP>Americans</NORP> were guardedly <EVENT type=""market_prediction"" VerbTime=""past""><SLOT name=""Pos_fin_word""><POS_FIN_WORD>optimistic</POS_FIN_WORD></SLOT> about the economy in <SLOT name=""Date""><DATE>the holiday season</DATE></SLOT></EVENT>.<S_END/><P_END/>"
 So we're still constructive about the market.,"Wed, Mar 7 2007 4:19 PM EST.",market_prediction,,"<P_START/><S_START/>Wed, <DATE>Mar 7 2007</DATE> <TIME>4:19 PM EST</TIME>.<S_END/> <S_START/>So we're still <EVENT type=""market_prediction"" VerbTime=""present""><SLOT name=""Pos_fin_word""><POS_FIN_WORD>constructive</POS_FIN_WORD></SLOT> about the market</EVENT>.<S_END/><P_END/>"
"In the only economic news of the day, the monthly sentiment index released by the National Association of Home Builders showed builders were less optimistic about the housing market in March.","Mon, Mar 19 2007 4:13 PM EDT. ",market_prediction,,"<P_START/><S_START/><DATE>Mon, Mar 19 2007</DATE> <TIME>4:13 PM EDT</TIME>.<S_END/> <S_START/>In the only economic news of <DATE>the day</DATE>, the <DATE>monthly</DATE> sentiment index released by <ORG>the National Association of Home Builders</ORG> showed builders were <EVENT type=""market_prediction"" VerbTime=""past"">less <SLOT name=""Pos_fin_word""><POS_FIN_WORD>optimistic</POS_FIN_WORD></SLOT> about the housing market in <SLOT name=""Date""><DATE>March</DATE></SLOT></EVENT>.<S_END/><P_END/>"
"Americans seem to like divided government, and that is what we have, McCullough said. CFOs are cautiously optimistic about the economy and planning for 2021.","Wed, Dec 2 2020 8:15 AM EST. ",market_prediction,,"<P_START/><S_START/>Wed, <DATE>Dec 2 2020</DATE> <TIME>8:15 AM EST</TIME>.<S_END/> <S_START/><NORP>Americans</NORP> seem to like divided government, and that is what <NORP normalized=""Americans"">we</NORP> have, <PERSON>McCullough</PERSON> said.<S_END/> <S_START/>CFOs are cautiously <EVENT type=""market_prediction"" VerbTime=""present""><SLOT name=""Pos_fin_word""><POS_FIN_WORD>optimistic</POS_FIN_WORD></SLOT> about the economy</EVENT> and planning for <DATE>2021</DATE>.<S_END/><P_END/>"
Billionaire investor Mario Gabelli said Wednesday that he was optimistic about the U.S. and global economy in 2021 and that he was bullish on several cyclical names and sports-related businesses next year.,"Wed, Dec 2 2020 4:04 PM EST. ",market_prediction,,"<P_START/><S_START/>Wed, <DATE>Dec 2 2020</DATE> <TIME>4:04 PM EST</TIME>.<S_END/> <S_START/>Billionaire investor <PERSON>Mario Gabelli</PERSON> said <DATE>Wednesday</DATE> that <PERSON normalized=""Mario Gabelli"">he</PERSON> was <EVENT type=""market_prediction"" VerbTime=""past""><SLOT name=""Pos_fin_word""><POS_FIN_WORD>optimistic</POS_FIN_WORD></SLOT> about the <GPE>U.S.</GPE> and global economy</EVENT> in <DATE>2021</DATE> and that <PERSON normalized=""Mario Gabelli"">he</PERSON> was bullish on several <SECTOR>cyclical</SECTOR> names and sports-related businesses <DATE>next year</DATE>.<S_END/><P_END/>"
"We're very excited about the Southeast Asia market, we think this is the next rising market, she said.","Thu, Dec 3 2020 11:31 PM EST. ",market_prediction,,"<P_START/><S_START/><GPE>Thu</GPE>, <DATE>Dec 3 2020 11:31</DATE> <TICKER>PM</TICKER> EST.<S_END/> <S_START/>We're <EVENT type=""market_prediction"" VerbTime=""present""><SLOT name=""Emphasis"" normalized=""strong"">very</SLOT> <SLOT name=""Pos_fin_word""><POS_FIN_WORD>excited</POS_FIN_WORD></SLOT> about the <LOC>Southeast Asia</LOC> market</EVENT>, we think this is the next rising market, she said.<S_END/><P_END/>"
"Baron said he remains optimistic about the market, saying the company has increased positions in several companies this year.","Tue, Jun 9 2020 7:58 AM EDT. ",market_prediction,,"<P_START/><S_START/>Tue, Jun 9 2020 <TIME>7:58 AM EDT</TIME>.<S_END/> <S_START/>Baron said he remains <EVENT type=""market_prediction"" VerbTime=""past""><SLOT name=""Pos_fin_word""><POS_FIN_WORD>optimistic</POS_FIN_WORD></SLOT> about the market</EVENT>, saying the <ORG>company</ORG> has increased positions in several companies <DATE>this year</DATE>.<S_END/><P_END/>"
"They seem to be more optimistic about the economy overall, said Kinahan, the firm's chief market strategist.","Mon, Jul 6 2020 7:45 AM EDT. ",market_prediction,,"<P_START/><S_START/><DATE>Mon, Jul 6 2020 7:45 AM EDT</DATE>.<S_END/> <S_START/>They seem to be more <EVENT type=""market_prediction"" VerbTime=""present""><SLOT name=""Pos_fin_word""><POS_FIN_WORD>optimistic</POS_FIN_WORD></SLOT> about the economy</EVENT> overall, said <GPE>Kinahan</GPE>, the <ORG>firm</ORG>'s chief market strategist.<S_END/><P_END/>"
"Current homeowners are also getting slightly more optimistic about the sales market, especially given the lack of housing supply.","Tue, Jul 7 2020 9:59 AM EDT. ",market_prediction,,"<P_START/><S_START/><DATE>Tue, Jul 7 2020 9:59 AM EDT</DATE>.<S_END/> <S_START/>Current homeowners are also getting slightly more <EVENT type=""market_prediction"" VerbTime=""present""><SLOT name=""Pos_fin_word""><POS_FIN_WORD>optimistic</POS_FIN_WORD></SLOT> about the sales market</EVENT>, especially given the <NEG_FIN_WORD>lack</NEG_FIN_WORD> of housing supply.<S_END/><P_END/>"
"What's great about the biopharma industry is that there's an incentive scheme for private industry to come up with drugs that meaningfully change the health-care dynamic in the country, he said in a phone interview.","Wed, Nov 11 2020 11:36 AM EST. ",market_prediction,,"<P_START/><S_START/>Wed, <DATE>Nov 11 2020 11:36 AM EST</DATE>.<S_END/> <S_START/>What's <EVENT type=""market_prediction"" VerbTime=""present""><SLOT name=""Pos_fin_word""><POS_FIN_WORD>great</POS_FIN_WORD></SLOT> about the biopharma industry</EVENT> is that there's an incentive scheme for private industry to come up with drugs that meaningfully change the health-care dynamic in the country, he said in a phone interview.<S_END/><P_END/>"
